{
  "$schema": "https://json-schema.org/draft/2020-12/schema",
  "$id": "https://osrs-ee.local/schemas/session_launch.schema.json",
  "title": "SessionLaunch v1.0",
  "type": "object", "additionalProperties": false,
  "required": ["schema_version","run_id","session_id","account_id","session_epoch","lease_id","lease_expires_at","client_instance_id","task_id","task_descriptor_hash","artifact_hash","config_hash","credential_ref","adapter_endpoint","adapter_token_ref","max_session_seconds","drain_timeout_seconds"],
  "properties": {
    "schema_version": {"$ref": "https://osrs-ee.local/schemas/common.schema.json#/$defs/schema_version"},
    "run_id": {"$ref": "https://osrs-ee.local/schemas/common.schema.json#/$defs/opaque_id"}, "session_id": {"$ref": "https://osrs-ee.local/schemas/common.schema.json#/$defs/opaque_id"}, "account_id": {"$ref": "https://osrs-ee.local/schemas/common.schema.json#/$defs/opaque_id"},
    "session_epoch": {"$ref": "https://osrs-ee.local/schemas/common.schema.json#/$defs/epoch"}, "lease_id": {"$ref": "https://osrs-ee.local/schemas/common.schema.json#/$defs/opaque_id"}, "lease_expires_at": {"$ref": "https://osrs-ee.local/schemas/common.schema.json#/$defs/rfc3339_utc"},
    "client_instance_id": {"$ref": "https://osrs-ee.local/schemas/common.schema.json#/$defs/opaque_id"}, "task_id": {"$ref": "https://osrs-ee.local/schemas/common.schema.json#/$defs/opaque_id"},
    "task_descriptor_hash": {"$ref": "https://osrs-ee.local/schemas/common.schema.json#/$defs/sha256_hex"}, "artifact_hash": {"$ref": "https://osrs-ee.local/schemas/common.schema.json#/$defs/sha256_hex"}, "config_hash": {"$ref": "https://osrs-ee.local/schemas/common.schema.json#/$defs/sha256_hex"},
    "credential_ref": {"$ref": "https://osrs-ee.local/schemas/common.schema.json#/$defs/ref"}, "adapter_endpoint": {"$ref": "https://osrs-ee.local/schemas/common.schema.json#/$defs/loopback_endpoint"}, "adapter_token_ref": {"$ref": "https://osrs-ee.local/schemas/common.schema.json#/$defs/ref"},
    "max_session_seconds": {"$ref": "https://osrs-ee.local/schemas/common.schema.json#/$defs/seconds"}, "drain_timeout_seconds": {"$ref": "https://osrs-ee.local/schemas/common.schema.json#/$defs/seconds"}
  }
}
