{
  "schema_version": "1.0",
  "run_id": "run_demo001",
  "session_id": "sess_demo001",
  "account_id": "acc_demo001",
  "session_epoch": 3,
  "lease_id": "lease_demo001",
  "lease_expires_at": "2026-10-23T20:00:00Z",
  "client_instance_id": "client_demo001",
  "task_id": "task_bank_probe",
  "task_descriptor_hash": "aaaaaaaaaaaaaaaaaaaaaaaaaaaaaaaaaaaaaaaaaaaaaaaaaaaaaaaaaaaaaaaa",
  "artifact_hash": "bbbbbbbbbbbbbbbbbbbbbbbbbbbbbbbbbbbbbbbbbbbbbbbbbbbbbbbbbbbbbbbb",
  "config_hash": "cccccccccccccccccccccccccccccccccccccccccccccccccccccccccccccccc",
  "credential_ref": "ref:vault:acc_demo001",
  "adapter_endpoint": "http://127.0.0.1:8081/agent",
  "adapter_token_ref": "ref:vault:adapter_demo001",
  "max_session_seconds": 3600,
  "drain_timeout_seconds": 120
}
